category,Contributions
Autre sujet,"Accès au #numérique Toutes les mairies, quelque soit la taille de la ville ou du village devrait donner l'accès à un ou plusieurs ordinateurs pour les administrés exclusivement. Idéalement l'accompagnement serait possible.
Les administrés devraient pouvoir accéder à différentes plateformes publiques pour leurs démarches administratives. 
Aujourd'hui certains centres sociaux, certaines médiathèques le permettent mais avec des contraintes d'horaires et d'inscriptions. L'hôtel de ville est l'endroit idéal pour donner un accès au numérique à tous les publics."
Autre sujet,Allocations chômage Plafonner les allocations à 4500 € par mois maximum
Autre sujet,"Education des métiers manuels Remettre (ou mettre ) des le plus jeune age des cours manuels :
cuisine,menuiserie,couture,bricolage ,etc....pour les 2 sexes
celà permet de revaloriser les métiers et est bon pour l'écologie : 
si on sait réparer,recoudre,cuisiner....on jette moins,on recycle plus !!!
et  l'on consomme moins de plats préparés et plus de plats cuisinés"
Autre sujet,"Légalisation de l'euthanasie et du suicide assisté  Je propose la légalisation de l'euthanasie et du suicide assisté, ainsi que l'accès universel aux soins palliatifs.
Les sondages, concordants, montrent que les Français sont favorables à la législation de l'euthanasie. Une liberté supplémentaire enrichit une société sans rien enlever à qui que ce soit."
Autre sujet,"Révision des barèmes sociaux Bonjour à tous,
La révision  du barème social permettrait de redonner du pouvoir d'achat à la classe qui se trouve entre deux paliers.  Pour ceux qui ne travaillent pas ils ont tous et ceux qui travaillent au SMIC ou un peu au dessus n'ont rien. Réviser le barème pourrait aider les familles à payer moins d'impôts, à bénéficier des APL, aides pour les vacances, la cantine des enfants et j'en passe. Et tout ça sans toucher les ménages aisés
Merci "
Autre sujet,"Obliger les entreprises a embaucher et former les personne handicapés  et sans diplôme  Je vous signal  que rien ai fait pour  les chromeurs handicapés 
Obligé les entreprises a embauché et arrêter d aller chercher des étranger
il faut que les enterprises a  a faire des forum ou salon de l emploi dans d autres département j entends les patrons par exemple de paris bordeaux dire qui ne trouve pas mais si ils comptent sur pole emploi il se trompent moi cela fait onze ans que je cherche du travail "
Autre sujet,"Notre système économique est-il bien adapté ? Organisation un sommet international où la question serait :
Le modèle économique dominant est-il toujours adapté aux nouveaux enjeux ? Cette question pourrait se décliner en plusieurs thématiques.
Notre système économique  :
_assure-t-il encore le partage équitable des richesses matériels et immatériels entre les individus?
_n'entrave-t-il pas la liberté et la souveraineté des peuples ?
_permet-il le développement positif des nations ?
_est-il cohérent à la survie de notre espèce et plus largement à son environnement ?"
Autre sujet,"Les prix à la consommation Autrefois, la baguette était vendue 0.50 centimes de Franc. Aujourd'hui elle est vendue 1, 50 €, soit près de 9.84 Francs. Le prix du blé a-t-il subi une augmentation de 10 fois son prix ? Les agriculteurs devraient être très riches. Mon salaire n'a pas non plus été multiplié par 10. Je ne parle pas des fruits et légumes, ni de la viande et encore moins du poisson. Le passage à l'euro n'a pas été contrôlé et les dérives constatées aujourd'hui sur le pouvoir d'achat viennent de là. Les grossistes et intermédiaires se servent trop largement au passage. Il faut donc instaurer des filières courtes. Cela amènera moins de pollution, des prix plus justes et des producteurs mieux rémunérés. Mais les gens devraient aussi admettre qu'on ne mange pas de tomates à Noël ni de choux en avril. Le bon sens doit être retrouvé par tous les consommateurs."
Autre sujet,"INSERTION sur le marché du travail Bonjour, 

Mon idée est de développer l'alternance ainsi que la possibilité de faire des stages dès la première année de faculté car nous avons un vrai problème au niveau de l'insertion des jeunes diplômés sur le marché du travail. 

Donner plus de moyens aux entreprises pour la formation. 

Merci pour vos réponses 
"
Autre sujet,"Formations aux métiers manuels Les jeunes pensent que la vie est faite de travail derrière un ordinateur. Plus personne ne veut devenir boulanger, couvreur, maçon, restaurateur. Ces métiers sont bien trop fatigants. Mais une bonne formation au sein de ces filières permet de trouver facilement un emploi. Le système éducatif doit permettre d'orienter vers ces métiers. Tout le monde ne peut pas être ingénieur ou cadre. Ce n'est pas la réforme du bac qui va favoriser l'emploi dans ces métiers. Il faut que ces métiers soient reconnus car ils nécessitent des compétences mais également du courage et donc une juste rémunération. Il faut également tenir compte de la pénibilité de ces métiers et ne pas obliger ces personnes à travailler jusque 65 ans et plus pour qu'ils aient une retraite décente."
Autre sujet,Assemblée constituante 6ème République Comment concrètement mettre au point une assemblée constituante  en vue d'une nouvelle constitution
Autre sujet,"Le Granddébat .fr trop partial et dirigé Sans prendre position pour l'un ou l'autre, je trouve que le site du granddébat.fr  est fait pour influencer les contributeurs et non pour lancer une vraie concertation :
il faut commencer par répondre à une série de question avant d'aborder le sujet qui nous tiens à cœur,
la mise en page est impossible, donc les textes trop longs sont illisibles
il est impossible de voter pour une idée qui nous semble intéressante.
la quasi totalité de forums n' agissent pas comme cela, il s'agit donc bien d'une volonté biaiser le débat, et de manipuler les résultats.
un début de campagne électorale prématurée aux frais des contribuables."
Autre sujet,"Un prélèvement inégalitaire sur les retraites complémentaires La loi de financement de la Sécurité sociale pour 2018 a supprimé, pour les salariés, outre leur cotisation chômage, leur cotisation maladie. Mais elle a maintenu le prélèvement spécifique  de 1 pour cent sur les retraites complémentaires, 
des retraités.
 Obtenir la suppression de celle ci  serait  que réparer une situation injuste et discriminatoire

"
Autre sujet,"Non au déploiement forcé des compteurs intelligents Linky  L'installation de ces compteurs ""intelligents"" devrait se faire uniquement avec le consentement des abonnés ou sur demande des abonnés. La société ENEDIS détient un monopole, le choix du consommateur n'est pas respecté lorsqu'il ne souhaite pas équiper son logement d'un compteur ""intelligent"". Ce genre de compteur ne devrait pas être imposé aux consommateurs. 

"
Autre sujet,"Sortir du surendettement sans dossier de surendettement Créer une charte avec huissiers, banques, organismes de prêts et organismes collecteurs ( impôts, Urssaf ... ) pour aider les gens qui choisissent de ne pas déposer un dossier de surendettement et de régler leurs dettes par échelonnement. Cette charte interdira les pratiques de recouvrement abusives qui poussent les débiteurs à abandonner leurs démarches et qui ne facilitent pas les issues positives. Si vous choisissez de payer , on réduit vos dettes, on vous aide à les regrouper malgré une interdiction bancaire. "
Autre sujet,"Revoir ses pratiques Quelque soit le sujet , la question n'est pas où doit-on réduire les dépenses ou que doit-on augmenter mais est-ce que ce que nous faisons est encore efficient actuellement.(ex) : est-ce que notre système éducatif est encore le meilleur au monde? non, comment y remédier, oui, il faut le conserver. On nous demande de faire des choix sur des coupes budgétaires ou sur d'autres sujets sans que l'on se soit intéressé à nos pratiques. De véritables analyses doivent être réalisées et les français doivent réfléchir à modifier leurs pratiques. Il ne faut pas rester sur des systèmes pouvant entraîner notre perte, simplement pour une question de principes syndicales ou sociales. Le service public est indispensable. la prise en compte de la mondialisation est indispensable. La transition écologique est primordiale pour notre survie. Les efforts doivent être collectifs mais également individuels. Des exemples dans des pays étrangers existent dans tous les domaines et ils ont fait leur preuve. "
Autre sujet,"Création d’une police militaire et renforcement des forces de l’ordre La France compte 150 000 policiers, 100 000 gendarmes et quelques 17 000 douaniers. D’année en année il manque de plus en plus de force de l’ordre malgré cela. Pour réaffecter des hommes, une solution simple existe. Convertir des militaires du rang en « police militaire ». Une formation militaire est une base pour devenir policier. En rapatriant une partie des quelques 17 000 militaires en opérations extérieurs, ainsi que des militaires de réserves on pourrait réaffecter entre 10 à 20 %  dans les forces de les forces de l’ordre conventionnelles. Cela ne coute rien au contribuable car on se limite au strict personnel existant.
"
Autre sujet,"Supprimer plusieurs types de contrats de travail  Les entreprises sont friandes des contrats précaires au détriment des salariés. Entre le portage salarial ou l’on prend une commission selon que vous ou votre employeur trouve le client, le travailleur détaché, le cdi intérim, la prestation de service, l’autoentreprise ou le salaire tombe à 45 jours … Parmi tous ces contrats l’un d’eux est vraiment dangereux. Une entreprise étrangère établie en France vous paye depuis son siège situé à l’étranger, résultat seules les cotisations sécu sont payées, pas les cotisations chômages. En fin de période d’essai vous n’êtes pas embauché ? L’équation est simple au chômage, sans ressources car l’entreprise n’a pas cotisé pour le chômage, situation financière précaire."
Autre sujet,"Promesses de Mr Macron          Nous demandons que le gouvernement entérine au   01 04 2019 les promesses  faites figurant dans son programme comme:
               1/ Option d’individualisation pour l’impôt sur le revenu  « Création d'une option d'individualisation de l'impôt sur le revenu pour les contribuables soumis à imposition commune (mariés ou unis par un Pacs) ».
  2/ « L’allocation adultes handicapés (AAH), pour une personne seule, est aujourd'hui d'environ 800 euros par mois : nous la porterons au-delà de 900 euros par mois »   
 3/ « Nous réduirons la pauvreté des personnes âgées. Le minimum vieillesse, pour une personne seule, est aujourd'hui d'environ 800 euros : nous le porterons au-delà de 900 euros » 
               4/« Nous imposerons les grands groupes de l’Internet sur leur chiffre d’affaires réalisé sur notre sol ».... 
             

 Pour la promesse 4 : : « imposition au même titre que les autres entreprises » 

"
Autre sujet,"Un vrai métier et un vrai statut pour les Aides de Vie Scolaire! Que l’Éducation nationale arrête de traiter les AESH ( ex Aides de Vie Scolaire) avec autant de mépris !!! Statut sans aucune reconnaissance, droit à aucune initiative dans son travail (pas même celui de faire un petit compte rendu de la journée avec les parents de l’enfant dont on s’occupe...) 
On promet des CDI au bout de 6 années en tant qu’AESH mais la plupart du temps les contrats ne sont pas renouvelés... Que l’État commence à avoir de la considération pour ce métier et ceux qui l'exercent... "
Autre sujet,"Modifier la loi ""alimention"" Annuler la suppression des super-promos sur les produits issus des grands groupes industriels.
En effet, c'est pénalisant pour le pouvoir d'achat et rien ne garantit qu'il y ait un transfert vers les produits agricoles qui eux ne doivent pas bénéficier du tout de promos ""vente à perte"", il en va de notre agriculture.
Par ailleurs ces super promos sont des pseudos pertes infinitésimales aux regard des bénéfices engrangés par ces groupes."
Autre sujet,"Adapter les prix aux volumes Faire en sorte que : plus le volume et/ou le poids d'un produit est grand, plus le prix au litre/kilo devrait baisser, ce qui est loin d'être le cas actuellement.
Par exemple, le prix au litre d'une bourriche 5l devrait être moins cher que le prix au litre d'un pack de 6 bouteilles d'eau 1,5l.
ou encore : le prix au kilo d'un paquet de céréales de 780g devrait être moins cher que le prix au kilo du même paquet proposé à 480g
etc, etc..
Les exemples sont très très nombreux.
C'est bon pour la planète et c'est bon pour le prote-monnaie!
Et puis, il faut inciter fermement les groupes industriels à le faire et pourquoi pas fixer une amende en cas de non-respect et qui serait reversée pour l'écologie.
"
