category,Contributions
"Impôts, dépenses, action publique","Faire des économies ? Il n’y a pas d’économies à faire (elles nous priveraient encore de services publics), il suffit de prendre légitimement l’argent là où il est, c’est-à-dire chez ceux qui obtiennent et font fructifier leur fortune grâce au travail des salariés et qui refusent de participer au pacte social (évasion fiscale des multinationales notamment). C’est à cause de ces gens-là que les classes moyennes paient trop d’impôt. Et c’est également en ne participant pas à l’impôt que leurs fortunes augmentent et que les inégalités se creusent."
Autre sujet,"Révision des barèmes sociaux Bonjour à tous,
La révision  du barème social permettrait de redonner du pouvoir d'achat à la classe qui se trouve entre deux paliers.  Pour ceux qui ne travaillent pas ils ont tous et ceux qui travaillent au SMIC ou un peu au dessus n'ont rien. Réviser le barème pourrait aider les familles à payer moins d'impôts, à bénéficier des APL, aides pour les vacances, la cantine des enfants et j'en passe. Et tout ça sans toucher les ménages aisés
Merci "
Autre sujet,"Obliger les entreprises a embaucher et former les personne handicapés  et sans diplôme  Je vous signal  que rien ai fait pour  les chromeurs handicapés 
Obligé les entreprises a embauché et arrêter d aller chercher des étranger
il faut que les enterprises a  a faire des forum ou salon de l emploi dans d autres département j entends les patrons par exemple de paris bordeaux dire qui ne trouve pas mais si ils comptent sur pole emploi il se trompent moi cela fait onze ans que je cherche du travail "
Autre sujet,"Notre système économique est-il bien adapté ? Organisation un sommet international où la question serait :
Le modèle économique dominant est-il toujours adapté aux nouveaux enjeux ? Cette question pourrait se décliner en plusieurs thématiques.
Notre système économique  :
_assure-t-il encore le partage équitable des richesses matériels et immatériels entre les individus?
_n'entrave-t-il pas la liberté et la souveraineté des peuples ?
_permet-il le développement positif des nations ?
_est-il cohérent à la survie de notre espèce et plus largement à son environnement ?"
"Impôts, dépenses, action publique","Résidences EHPAD Coût supporté par le résident en fonction de ses moyens financiers :salaires, retraites, patrimoine mobilier et immobilier"
Autre sujet,"Les prix à la consommation Autrefois, la baguette était vendue 0.50 centimes de Franc. Aujourd'hui elle est vendue 1, 50 €, soit près de 9.84 Francs. Le prix du blé a-t-il subi une augmentation de 10 fois son prix ? Les agriculteurs devraient être très riches. Mon salaire n'a pas non plus été multiplié par 10. Je ne parle pas des fruits et légumes, ni de la viande et encore moins du poisson. Le passage à l'euro n'a pas été contrôlé et les dérives constatées aujourd'hui sur le pouvoir d'achat viennent de là. Les grossistes et intermédiaires se servent trop largement au passage. Il faut donc instaurer des filières courtes. Cela amènera moins de pollution, des prix plus justes et des producteurs mieux rémunérés. Mais les gens devraient aussi admettre qu'on ne mange pas de tomates à Noël ni de choux en avril. Le bon sens doit être retrouvé par tous les consommateurs."
,Egalité d'accès aux études Augmenter les plafonds pour l'attribution des bourses et des aides au niveau scolaire afin de permettre à tous d'accéder de manière égale à toutes les écoles à toutes les formations ; lutte contre l'école des riches et des pauvres; aujourd'hui certaines écoles compte tenu des tarifs d'inscription imposés sont inaccessibles aux familles aux revenus modestes ; au 21ème siècle c'est inacceptable ! cela ne devrait plus exister
Transition écologique,Lutte contre la polution Intervenir auprès des entreprises pour qu'elles diminuent voir suppriment les emballages de leurs produits ;  moins d'emballage diminue le coût des produits et donc le prix :  permet de lutter contre la pollution et de redonner du pouvoir d'achat 
"Impôts, dépenses, action publique","CICE : Dépense publique de 40 Milliards d'Euros sur 2 ans. Ce sont les sociétés du CAC40 qui en profitent le plus, avec des licenciements. Cibler le CICE pour les TPE/PME, avec une modulation pour tenir compte des emplois crées."
Transition écologique,"Consigne d’emballage et compostage Pour réduire drastiquement les déchets, plusieurs idées simples. Généraliser la consigne des emballages (bouteille, tétrabrick …) et généraliser des systèmes de compostage des déchets vert dans les quartiers & ou communes (à grande échelle en somme). 
"
"Impôts, dépenses, action publique","Relance du ferroviaire & fluvial En mettant camions et containers sur des péniches ou le rail, voire dans certains cas en relançant l’auto-train, les redevances de circulation sur le domaine fluvial & ferroviaire, ainsi qu’une partie des recettes de la « billetterie » des voyages doivent servir pour entretenir et améliorer ce réseau. Des exemples concrets de travaux à mener > doublement des lignes Béthune <> Lille, Orchies <> Villeneuve d’Ascq , réutilisation des voies existantes pour le TGV Bordeaux <> Toulouse <> Montpellier en lieu et place d’une LGV neuve. Le but final est d’avoir des recettes sans pour autant tomber dans les taxes à outrance. "
,"Lutte contre la pauvreté Interdiction pour les services administratifs (caf par exemple) de supprimer les aides sans délais raisonnable (2 mois), sans prévenir suffisamment à l'avance  afin de laisser à chacun la possibilité de se défendre et de fournir les pièces nécessaires  avant de créer une réelle précarité de ces personnes déjà fragilisées; "
"Impôts, dépenses, action publique","Aide aux migrants Il faut diminuer les aides aux migrants. Pourquoi tous ces migrants viennent-ils en France et ne vont pas en Russie ou en Chine ? Dans ma ville, on a réquisitionné des hôtels pour y loger 3 ou 4 migrants par chambre. Deux mois après, une visite des élus a permis de constater qu'ils étaient plus de 8 à 10 chambres. Tous les mardi et vendredi, je les vois passer devant chez moi pour aller au restaurant du cœur et revenir avec des sacs de denrées dont certains sont jetés derrière des haies car les produits donnés ne leur conviennent pas. C'est écoeurant  et ce ne sont pas les français qui profitent des dons de leurs concitoyens.
Si vous voulez vivre en France, alors rendez un minimum de service à la collectivité qui vous accueille en contrepartie des aides que vous recevez. "
Démocratie et citoyenneté,"Réferendum d'initiative populaire Pour un véritable référendum d'initiative populaire et non pas la mascarade du référendum partagé ou en plus de millions de gens il faut 180 députés pour lancer la procédure! 
Le RIP devrait pouvoir être étudié à partir d'un certains seuil de signatures, quelques centaine de milliers par exemple et sans sujet tabous, ce n'est pas à Monsieur Griveaux de décider pour les français des sujets qui peuvent êtres abordés et ceux qui ne le peuvent pas!
Le pouvoir a peur du peuple.
Démocratie: le kratos appartient au demos, au peuple! Chez nous la démocratie a été confisqué par les représentants du peuple qui ne représentent plus qu'eux même ou les intérêts des puissants.


"
Transition écologique,"Stationnement de voirie, parking, végétalisation du stationnement et perméabilité des sols Au lieu de créer une pénurie de place de stationnement, d’avoir une pression automobile avec  stationnement anarchique,  de respecter la perméabilité des sols. Il convient, dans la mesure du possible de remplacer le macadam existant par des dalles de bétons creuses afin de remettre de la terre et permettre l’écoulement de l’eau dans les sols. Une place parking standard fait 2,5m x 5m soit 12,5 m² . Le même raisonnement est à appliquer à des cheminements piétonniers. Ce processus permet de regagner des m² de verdure en espace fortement bétonné. 
"
"Impôts, dépenses, action publique","Grands patrons, scandales, licenciement & parachutes dorés De récentes actualités ont montré des scandales financiers avec des grands patrons. Dernier en date avec le scandale du patron de Renault-Nissan. Dans ce type de situation, quand la justice met son nez dans les affaires pour scandale financier, piratage de masse, tricherie commercial, fraude … le dirigeant en question ne devrait pas toucher son « parachute doré ». Pour appliquer la mesure rien de plus simple, dès qu’un dirigeant a des intérêts en France, que des avoirs sur le sol français sont en jeu c’est interdire tout ou partie de ces avoirs. Qu’un contrat ai été signé ou non."
Autre sujet,"INSERTION sur le marché du travail Bonjour, 

Mon idée est de développer l'alternance ainsi que la possibilité de faire des stages dès la première année de faculté car nous avons un vrai problème au niveau de l'insertion des jeunes diplômés sur le marché du travail. 

Donner plus de moyens aux entreprises pour la formation. 

Merci pour vos réponses 
"
Autre sujet,"Formations aux métiers manuels Les jeunes pensent que la vie est faite de travail derrière un ordinateur. Plus personne ne veut devenir boulanger, couvreur, maçon, restaurateur. Ces métiers sont bien trop fatigants. Mais une bonne formation au sein de ces filières permet de trouver facilement un emploi. Le système éducatif doit permettre d'orienter vers ces métiers. Tout le monde ne peut pas être ingénieur ou cadre. Ce n'est pas la réforme du bac qui va favoriser l'emploi dans ces métiers. Il faut que ces métiers soient reconnus car ils nécessitent des compétences mais également du courage et donc une juste rémunération. Il faut également tenir compte de la pénibilité de ces métiers et ne pas obliger ces personnes à travailler jusque 65 ans et plus pour qu'ils aient une retraite décente."
"Impôts, dépenses, action publique","Indemnisation chômage On devrait tenir compte du nombre d'années que l'on a cotisé sur nos fiches de payes pour le chômage, et ne pas indemniser tout le monde au même tarif.
J'ai travaillé 30 ans dans la même société donc 30 ans de cotisations ""chômage"", puis 10 ans en contrat aidé.
Mr MACRON va aider la ""grande pauvreté"" grâce notamment à la suppression des contrats aidés qui ""coûtaient trop cher à l'état"". ""Grâce à cela"", j'ai perdu mon contrat le 1er septembre 2018 (à un an de la retraite, on aurait pu me renouveler) et je vais ""grossir"" le chiffre des demandeurs d'emplois (avec tous les problèmes qui en découlent) et me retrouver dans la catégorie des personnes qui vivent en dessous du seuil de pauvreté avec environ 540 €. Le calcul des indemnités ne tient pas compte des cotisations ""chômage"" enlevées depuis 41 ans sur mes fiches de payes mais seulement sur mon dernier salaire. 

"
Autre sujet,Assemblée constituante 6ème République Comment concrètement mettre au point une assemblée constituante  en vue d'une nouvelle constitution
Démocratie et citoyenneté,Fin de vie  des personnes âgées Se pencher sur les problèmes de fin de vie des personnes âgées atteinte d’Alzheimer en particulier
"Impôts, dépenses, action publique","Stopper les 1% d'embellissement annuel Chaque l'état et les collectivités dépensent 500 millions d'euros pour le simple embellissement d'ouvrages ou lieu. Cette dépense doit être stoppée, trop couteuse en temps de raréfaction de l'argent publique.
"
Transition écologique,"Adaptation du materiel sur les petites lignes de TC et de rail  Relancer les mises en services des draisines pour desservir les petites lignes de trains , miniaturiser des BHNS via des minibus sur des lignes en milieu rural et périurbains (max 25 à 30), lancement d'un service ""d'autobus-rail"" qui peut à la fois aller sur les routes et les voies de chemin fer faiblement desservies
"
"Impôts, dépenses, action publique","TIPP sur le fioul des bateaux et le kérosène  Supprimer la niche fiscale sur la non taxation du fioul des bateaux croisière/ferries & la non taxation du kérosène.   
"
Autre sujet,"Le Granddébat .fr trop partial et dirigé Sans prendre position pour l'un ou l'autre, je trouve que le site du granddébat.fr  est fait pour influencer les contributeurs et non pour lancer une vraie concertation :
il faut commencer par répondre à une série de question avant d'aborder le sujet qui nous tiens à cœur,
la mise en page est impossible, donc les textes trop longs sont illisibles
il est impossible de voter pour une idée qui nous semble intéressante.
la quasi totalité de forums n' agissent pas comme cela, il s'agit donc bien d'une volonté biaiser le débat, et de manipuler les résultats.
un début de campagne électorale prématurée aux frais des contribuables."
Autre sujet,"Un prélèvement inégalitaire sur les retraites complémentaires La loi de financement de la Sécurité sociale pour 2018 a supprimé, pour les salariés, outre leur cotisation chômage, leur cotisation maladie. Mais elle a maintenu le prélèvement spécifique  de 1 pour cent sur les retraites complémentaires, 
des retraités.
 Obtenir la suppression de celle ci  serait  que réparer une situation injuste et discriminatoire

"
Démocratie et citoyenneté,"Que les élus assument leur actes En cas de poursuites judiciaires, pas d'immunité parlementaire. si condamnation, renvoi des élus et réorganisation d'un vote...  casier vierge obligatoire... que certains aillent en détention s'il le mérite. les juges sont trop cléments avec des élus qui sont censés montrer l'exemple"
"Impôts, dépenses, action publique","Grands équipements de loisirs, sportifs et folie des grandeurs  Depuis le début des années 2010 on ne compte les nombreux projets de stades, aréna, zéniths et autres salles omnisport. Un exemple concret avec les stades de foot du nord de la France. Autour de Lille dans un rayon de 80 km, pas moins de 8 équipes sportifs dont 6 stades de foot ont été remis en l'état. Ces travaux ont couté la bagatelle de quelques 850 millions d'euros, à lui seul le stade de Lille a couté 350 millions d'€. Ce type d'équipement est bien trop couteux à entretenir (quelques 150 millions pour les stades ans les Hauts de France). Pour preuve que ce type d'infra n'a plus la quote, l'état cherche à vendre le Stade France pour quelques 500 millions d'€. Ici encore de grandes sources d'économies sont à effectuer."
Démocratie et citoyenneté,"Apprentissage des langues (LV2) et pays frontaliers Rendre prioritaire l’apprentissage des langues vivantes (LV2) en fonction des pays frontaliers. Privilégier l’espagnol/portugais/catalan dans le quart sud-ouest de la France, privilégier l’italien et l’allemand dans l’est et le sud-est du pays, privilégier le néerlandais et l’allemand dans le quart nord de la France. Il existe des nombreuses aberrations, par exemple dans le Nord et le Pas de Calais l’apprentissage du néerlandais n’est pas suffisant voire inexistant. Nos voisins belges de la région flamande déplorent un manque d’apprentissage des francophones … alors qu’eux maitrisent parfaitement le français."
,"Revenu sportif, sponsoring, naming & évasion fiscale Dans le domaine du sport tout particulièrement en sport automobile (F1, Rally..), Golf, Foot, Basket, cyclisme, boxe, catch … Les sportif de haut niveau ainsi que les clubs arrivent à trouver des combines pour payer gracieusement leurs athlètes. Arrivé à un moment dans le Foot cela commence à devenir plus qu’indécent avec des salaires de plusieurs centaines de millions d’euros. Sans oublier que les sommes en jeu transitent par la France sans être taxées ou alors à des niveaux très bas. A noter également des entreprises qui arrivent à faire du sponsoring et du naming d’équipement sportif tout en échappant à l’impôt et bénéficient de niches fiscales. Tout revenu de la sorte doit être soumis à impôt. Les sommes brassées de manières annuelle avoisinent les 750 millions d’euros annuels rien que pour le sponsoring et naming."
"Impôts, dépenses, action publique","Taxe - évasion fiscale, transfert de fond, MoneyGram & Western Union Chaque année des sociétés comme MoneyGram & Western Union font transiter près de 200 milliards d’€ et près de 60 milliards d’€ entre l’Europe, l’Afrique et une partie de l’Asie. Dans la plus totale impunité ces transferts de fond laissent passer du blanchiment d’argent, trafic en tout genre. Là encore en mettant plus de contrôle l’état peut faire cesser une évasion fiscale et du trafic d’argent au nez et à la barde des autorités."
,"Collectivités territoriales Accentuer la création de communes nouvelles par le rassemblement des très petites communes , la mutualisation des moyens et source d'économie et permet de proposer aux citoyens des services plus efficaces"
Autre sujet,"Non au déploiement forcé des compteurs intelligents Linky  L'installation de ces compteurs ""intelligents"" devrait se faire uniquement avec le consentement des abonnés ou sur demande des abonnés. La société ENEDIS détient un monopole, le choix du consommateur n'est pas respecté lorsqu'il ne souhaite pas équiper son logement d'un compteur ""intelligent"". Ce genre de compteur ne devrait pas être imposé aux consommateurs. 

"
"Impôts, dépenses, action publique","Mutuelle, assurance maladie, remboursements & chiffre d’affaire La France compte près de 550 mutuelles. Le modèle économique ne permet pas pour une mutuelle de faire du chiffre d’affaire. Les CPAM et la CNAM sont bâties sur le même modèle, aucun chiffre d’affaire n’est autorisé. Résultat comme ces organismes sont perpétuellement en besoin de financement. Pour éviter que l’état ne mette de l’argent comme dans un puit sans fond, la solution consiste à rationaliser le nombre d’acteur d’une part.  D’autre part c’est permettre aux CPAM et la CNAM d’avoir une branche « mutuelle ». Le but final est de permettre d’avoir des « recettes » sans augmenter les cotisations. A défaut faire arriver la « balance » à zéro. Le nombre d’acteur du secteur est donc à rationnaliser également. Les « recettes » annuelles des CPAM et CNAM grâce aux cotisation sont de l’ordre de 200 milliards annuelle.  
"
"Impôts, dépenses, action publique","Défiscalisation des heures supplémentaires, des primes, de l’intéressement et de la participation  Lorsqu’une personne travaille plus c’est surtout pour gagner plus. Tout salaire gagné en travaillant en plus de manière « bonus » ne doit pas être soumis à impôt."
,"Diminution de la dépense publique Suppression du sénat, et suppression de tous les  privilèges accordés ; remboursement de frais liés à la fonction uniquement sur justificatifs   dans un soucis de diminution de la dépense publique "
,"Mandat impératif et référendum révocatoire Les élus ne peuvent bénéficier d'un chèque en blanc pendant plusieurs années  et escomptant sur le marketing politique et la propagande pour se faire réélire même si leur mandat à été improductif ou est allé à l'encontre des intérêts des électeurs.
Le mandat impératif et le référendum révocatoire permettront de de déloger de leurs postes les élus qui par exemple seraient impliqués dans des affaires de corruption ou même simplement qui n'auraient pas tenus les promesses faire aux citoyens: il seront ainsi obligés de remettre leur mandat en jeu après un délai qui reste à déterminer: 2 ans par exemple ou sans  délai en cas de corruption"
"Impôts, dépenses, action publique","CSG et retraite inégalités Je souhaite que la csg ne soit plus prelevée  sur toutes les retraites ,hormis celles des personnes assujetties à l isf ,dont je souhaite egalement le retablissement."
"Impôts, dépenses, action publique","Fin de l'Aide Médicale d'Etat pour les étrangers en situation irrégulière. L'A.M.E. c'est un coût de 1 milliard par an, alors que beaucoup de français renoncent à se soigner faute d'argent.
Cette situation den peut plus durer: Exigeons la suppression de l'A.M.E. qui est une des nombreuses pompes aspirantes de l'immigration."
Transition écologique,"Le climat, c'est notre santé: la révolution de la prévention Le climat, c’est notre santé, celle des générations actuelles et futures. Pourtant, les différentes formes de lutte contre le dérèglement climatique ne sont toujours pas comprises comme des politiques de santé, de prévention et d’hygiène. Comment faire interagir la question climatique aux autres enjeux de la santé environnement (santé au travail, pollution des milieux, perturbateurs endocriniens, etc.)?
Dans son discours de Nevers du 6 janvier 2017, le candidat Emmanuel Macron à l'élection présidentielle promet une ""révolution de la prévention"". Au moment où la France est tenue par ses engagements internationaux à engager une décarbonation rapide de son économie, pouvons-nous bâtir autour de cette ""révolution de la prévention"" une stratégie concertée entre les professionnels de la santé, de l’environnement et du climat en vue d’une meilleure visibilité et d’une plus grande efficacité de ces trois domaines de l’action publique?"
,"Prix de l'électricité Suppression des taxes sur la facture d'électricité ou limiter le taux 5 % maximum ; aujourd'hui tout fonctionnent à l'électricité ; c'est un produit de 1ère nécessité  , une obligation  et aujourd'hui les taxes représentent parfois 40% de la facture = redonner du pouvoir d'achat "
"Impôts, dépenses, action publique","Supprimer ou diminuer la CSG pour tous les RETRAITES et indexation des retraites de TOUT LE MONDE  Tout comme la TVA que tout le monde paie, la suppressions ou la diminution de la CSG pour TOUTES LES RETRAITES ainsi qu'une revalorisation de TOUTES LES RETRAITES de tout le monde sur le coût de la vie"
,"Réduction du mille-feuille administratif La France comporte 96 départements métropolitains et 11 DOM TOM. Ces collectivités comportent des aberrations en outre mers. Il faut supprimer les statuts de ""département-région"" autonome. Pour cela il faut regrouper les collectivités de Saint Martin , Saint Barthélemy, Guadeloupe , Martinique, Guyane & Saint Pierre - Miquelon dans une région unique ""Antilles - Atlantique"" , regrouper les collectivités de Mayotte et la Réunion dans une collectivité unique ""Océan Indien"", pour finir regrouper les collectivités de l'océan pacifique comme la Polynésie, Wallis et Futuna avec la Calédonie en une région unique «Océan Pacifique ».
"
"Impôts, dépenses, action publique","Arrêts des taxes sur l'automobile (18 existantes & 10 en projet) Il existe à l’heure actuelle 18 taxes sur l’automobile. Dans les cartons du gouvernement et de l’UE il y en a 10 supplémentaire dans les cartons. Parmi ces taxes on peut citer : la taxe anti bouchon voulu par l’UE, la modulation du péage en fonction de sa voiture et de la pollution, le projet de loi sur les pneus neiges, les péages urbains … Avoir près de 28 sur l’automobile deviendrait juste financièrement impossible pour bon nombre de concitoyen. Ne parlons pas des taxes et vignettes transfrontalières pour les personnes vivant à proximité de la Suisse ou l’Allemagne ou ces taxes sont encore plus. "
"Impôts, dépenses, action publique","Sauvegarde et amélioration du Pouvoir d'achat Restaurer l’indexation totale des retraites sur les salaires ou l’inflation jusqu’à 2 500€  mensuels pour une personne seule et 4 000€ pour un couple, partielle  (50%) au-delà.
Focaliser la baisse des charges sur les salaires inférieurs ou égaux à  2 500 €.
Augmenter encore la prime d’activité pour les salariés à temps plein ou à temps partiel non choisi, pas le SMIC.
"
Organisation de l’Etat et des collectivités publiques,"Décentralisation de l'État au niveau régional Je suggère un ""parlement régional"" sans rétribution aux participants ; sacro-saint argent qui pourrit les prises de décision. chaque région est différente et possède ses propres spécificités ; Toulouse et Bordeaux… ne rencontrent pas les mêmes problématiques que les Hauts-de-France ; 
Parlement composé d'une trentaine de membres, choisis par vote des citoyens dans la population de la région, représentants  tous types de catégories sociales. Sans appartenance politique ! Sans sombrer dans la ""réunionite"" ! chaque membre élu, révocable une fois par an, s'engage en signant une ""charte d'engagement"" donne son avis sur une proposition nationale nous concernant, propose, invente, innove, relaie, informe.  L'outil informatique ne sert pas qu'à relayer les ""infosses"" !"
