category,Contributions
Organisation de l’Etat et des collectivités publiques,"Réforme de l'audiovisuel publique  Supprimer les chaines tv Première outremer et France O. Ces deux chaines font du décrochage local doublon avec France 3. Autant  basculer l’ensemble sur la chaine France 3 . 
Supprimer FranceInfo TV qui alourdit les chaines d’infos 24/24. 
Conserver France 2 , 3 , 4 & 5 .
Réduction des parts de l’état français dans TV5Monde & faire mettre à contribution plus de média francophone Suisse, Belge , Canada etc … 
Abandon de France 24 qui un doublon avec FranceInfo TV qui alourdit les chaines d’infos 24/24.
Abandon de la radio MCD. 
Diminuer les part dans le groupe Arte à 33% en fusionnant Arte France / Belgique et Allemagne en une chaine unique.
Basculer LCP en web TV et libération du canal 13 de la TNT.
Abandonner les radios Le MOUV, Le Fip & France Musique.
Conserver 4 radios : RFI, France Bleu , France Inter et France Culture.
Supprimer FranceInfo Radio."
Organisation de l’Etat et des collectivités publiques,"Réduire le nombre d'administrations publiques Le nombre d'administrations publiques (état, collectivité locale, administration appartenant à l'état ... ) représente la bagatelle de 60 000 services. Dans le cadre d'une meilleure organisation des services on peut en regrouper. Par exemple la CNIL, l'ARCEP, l'HADOPI, le CSA et l'ANSSI peuvent être regroupés dans une seule et même agence voir deux maximums. Les frais de gestions en matière de personnel , de locaux , d'informatique et de service informatique seraient grandement réduit et moins couteux pour le contribuable. Des agences comme l'HADOPI pourraient même ne plus être déficitaire via un regroupement avec d'autres services à même vocation."
"Impôts, dépenses, action publique","Revenu universel & aides sociales Mettre en place un système de ""package"" par rapport au revenu universel pour éviter les abus. L'allocataire bénéficie d'un ""menu"" ou le revenu universel couvre plusieurs types d'aides (CAF,CPAM,pole emploi ...) et renonce à avoir quelques autres aides que ce soit. Autre solution il reste sur le système actuel et ne peut bénéficier du revenu universel. Cela afin de contrer les abus. 
"
Organisation de l’Etat et des collectivités publiques,"A l'image des Food truck créer l'administration mobile En milieu rural créer un service publique ""mobile"" , pour les impôts, les opérateurs télécoms, d'énergies et divers services pour que l'état et les collectivités se rapprochent des citoyens isolés. Des campings car et vans pourraient être utilisés pour cela.
"
"Impôts, dépenses, action publique","Organe – bureau de contrôle de la filiation et des groupes d’entreprises Au niveau européen dans un premier temps et au niveau mondiale dans un second temps, établir une cartographie des entreprises pour cibler quelle entreprise possède quelle autre entreprise. Ce système doit rendre obligatoire pour chaque entreprise de déclarer l’ensemble des filiales de son groupe. En cas de manquement de déclaration ou de détection d’activité illégale d’une filiale (évasion fiscale, fraude …) il sera plus facile d’attaquer les entreprises en justice pour récupérer les dues. A l’heure du big data, les entreprises savent tout sur leurs clients, il devient impératif de jouer à arme égale pour plus de transparence. Un système de détection des filiations doit permettre de bloquer un groupe qui fait du profit et de déclarer une filiale en faillite. Les données issues des recensements devront être en libre accès pour plus de transparence. 
"
"Impôts, dépenses, action publique","Stopper la construction de giratoires et ronds-points Depuis les années 1970 la France a construit 65 000 giratoires en métropole et 2 500 dans les DOM TOM. Un ouvrage de la sorte coute en moyenne 500 K€. Cela représente un investissement de 32 milliards d'€ en plus de 40 ans. En métropole entre 2016 et 2018 il y a eu 4 500 ouvrages supplémentaires, pour un cout de 2,25 milliards d'€. Ce type d'aménagement est nuisible non seulement pour l'environnement (artificialisation des sol, occupation de terre agricole) , mais également générateur d'embouteillage (donc de pollution). On ne compte plus les voies rapides ou les contournements de communes ou ces ouvrages fleurissent et génèrent des retenues, sachant que des axes en question sont fréquentés par plus 40 000 véhicules selon les cas (autour de Lille, Nantes, Toulouse, Montpellier, Nîmes …). Autour de Lille, Nantes ou Nîmes durant les heures de pointes ces infrastructures paralysent le réseau secondaire et primaire à cause des échanges non dénivelés. "
Transition écologique,"Réduction durable de la dépendance des  Français à la voiture - Mettre en place des réglementations efficaces à destination des constructeurs automobiles. A ce jour, leur  offre de véhicules n’est pas alignée avec l’accord de Paris ni avec les besoins pour les français de réduire leur vulnérabilité à la hausse des prix des 
carburants. 
- Une échéance de moyen terme doit être fixée dans la loi mobilités pour interdire à la vente les véhicules diesel et essence.  Pour se donner le plus de chances de limiter le réchauffement de la planète au plus près de 1,5°C, le cap doit être établi à un horizon 2030. 
Ce signal clair donné aux constructeurs automobiles est indispensable pour que dès à présent, ces derniers développent des véhicules adaptés, moins énergivores en ressources énergétiques. "
Organisation de l’Etat et des collectivités publiques,"Renforcement de l'économie sociale et solidaire et de l'économie collaborative - Garantir son accès au financement et aux marchés publics
- Reconnaître un droit de préemption aux salariés pour former une coopérative en cas de fermeture ou de vente de leur entreprise
- Encadrer le développement des activités liées à l'économie collaborative pour préserver le caractère de partage et d'utilité sociale contre la privatisation, l'évasion fiscale, la concurrence déloyale et stopper l'""ubérisation"" des activités"
Organisation de l’Etat et des collectivités publiques,"Hauts fonctionnaires, salaires & nombres La France dispose de 21 500 hauts fonctionnaires, dont 650 hauts fonctionnaires avec des salaires de plus 180 000 € annuels bruts. L’ensemble de ces fonctionnaires se retrouvent dans les ministères, hautes administrations (CNAM, CNAV …) et quelques 60 000 administrations publiques. Afin de faire des économies le nombre de hauts fonctionnaires ainsi que les avantages liés aux postes sont à réformer. La suppression des échelons pyramidale est aussi à effectuer pour réduire la course aux titres des fonctions dans les hautes sphères de l’état.  "
"Impôts, dépenses, action publique","Bénéficier de son épargne collective - salariale, PERE, PERCO et fin de contrat de travail Lorsqu’un salarié quitte une entreprise celui-ci doit pouvoir bénéficier de l’intégralité des avoirs que l’entreprise lui a mis à disposition. Souvent par méconnaissance ce type d’épargne dort sur des comptes et n’est pas réclamé. Les organismes financiers se servent dessus en frais de gestion annuel, jusqu’à épuisement des fonds. Dans d’autre cas avec les PERCO les sommes ne sont pas récupérables avant la retraite du salarié. Ce type de situation est pénalisante pour les personnes en contrat court de type CDD/Intérim qui ont besoin de cet argent. L’argent est bloqué, une condition de doit être instauré pour que le salarié bénéficie de 100% de ces avoirs une fois l’entreprise quittée. Les personnes ayant eu de nombreux CDD / intérim se retrouvent souvent avec 4 voire 5 PERCO bloqué."
Démocratie et citoyenneté,"Transformation du train de vie de ""nos représentants"" Afin de permettre l'évolution et ""l'efficacité"" de notre démocratie institutionnelle: 
- Diminution effective de moitié des élus
- Fin des rémunérations et des avantages à vie liés à la fonction des représentants de l'état (présidents, députés, sénateurs, hauts fonctionnaires...)
- Plafond des rémunérations
- Justification et  contrôle des frais des élus, sanctions afférentes
- Cumul de mandats prohibé 
- Baisse de rémunération des chefs d'entreprises d'état
- Accélération du processus de décisions à l'Assemblée Nationale et au Sénat
- Ouverture du sénat à d'autres corps électoraux, à d'autres représentants de la Société Civile
"
"Impôts, dépenses, action publique",Enlever niveaux pour l'accès aux aides Il me semble injuste de définir des niveaux a l'Euro près pour avoir droit ou non a une aide. Il serait plus équitable de faire un diminution linéaire de l'aide.
"Impôts, dépenses, action publique","Actualisation & trop perçus Pôle Emploi Chaque mois les personnes en situations de chômage ou travail temporaire doivent s’actualiser à Pôle Emploi. Trop souvent encore ce système connait ces limites, documents des attestations Assedic non pris en charge par Pôle Emploi, oublie de considération de documents, système d’actualisation peut clair …. Résultat chaque année cela génère de plus en plus de trop perçu, de l’ordre de 1 milliards d’€ en 2018. Pour éviter de telles situations avec des chômeurs aux pieds du mur à devoir rembourser des sommes qu’ils n’ont pas les moyens de rendre, c’est retravailler le système de déclaration mensuelle plus finement. Par exemple avec un système calendaire, séparer le type de salaire (salaire, prime, indemnité … ) . Bon nombre de chômeurs se font avoir avec le système actuel de déclaration du salaire lors d’une fin de contrat. Ici encore en guidant mieux le publique un gâchis d’argent publique, ainsi qu’éviter de mettre des personnes en difficulté financière est réalisable."
Démocratie et citoyenneté,"Maitriser l'immigration: Fin du regroupement familial et droit du sang pour l'acquisition de la nationalité. Selon un sondage de 2016 ,une large majorité de Français (59%) se dit favorable à la suppression du regroupement familial, un dispositif instauré en 1976 en France, qui constitue l'essentiel des entrées d'étrangers en France. 
250 000 étrangers arrivent légalement chaque année , soit 1 millions tous les 4 ans! et ne parlons pas des clandestins qui ne sont même plus reconduits à la frontière... 20 000 expulsions par an, une goutte d'eau  Le peuple Français n'a jamais été consulté sur l'accueil de tant d'étrangers au point de voir notre culture,  notre mode de vie bouleversés .
 A Mayotte le gouvernement français a restreint le droit du sol face à aux Comoriennes qui  accouche à Mayotte pour que leur enfants deviennent  Français, ce qui est valable pour Mayotte doit l’être pour tout le territoire français: Suppression du droit du sol et re-instauration du droit du sang pour l'acquisition de la nationalité "
"Impôts, dépenses, action publique",Revoir le fonctionnement des aides pour les gardes d'enfants Le remboursement de la CAF pour le libre mode de garde devrait être payé directement aux crèches et non en remboursement. Actuellement cela peut induire des situations difficile pour les parents.
Autre sujet,"Sortir du surendettement sans dossier de surendettement Créer une charte avec huissiers, banques, organismes de prêts et organismes collecteurs ( impôts, Urssaf ... ) pour aider les gens qui choisissent de ne pas déposer un dossier de surendettement et de régler leurs dettes par échelonnement. Cette charte interdira les pratiques de recouvrement abusives qui poussent les débiteurs à abandonner leurs démarches et qui ne facilitent pas les issues positives. Si vous choisissez de payer , on réduit vos dettes, on vous aide à les regrouper malgré une interdiction bancaire. "
Autre sujet,"Revoir ses pratiques Quelque soit le sujet , la question n'est pas où doit-on réduire les dépenses ou que doit-on augmenter mais est-ce que ce que nous faisons est encore efficient actuellement.(ex) : est-ce que notre système éducatif est encore le meilleur au monde? non, comment y remédier, oui, il faut le conserver. On nous demande de faire des choix sur des coupes budgétaires ou sur d'autres sujets sans que l'on se soit intéressé à nos pratiques. De véritables analyses doivent être réalisées et les français doivent réfléchir à modifier leurs pratiques. Il ne faut pas rester sur des systèmes pouvant entraîner notre perte, simplement pour une question de principes syndicales ou sociales. Le service public est indispensable. la prise en compte de la mondialisation est indispensable. La transition écologique est primordiale pour notre survie. Les efforts doivent être collectifs mais également individuels. Des exemples dans des pays étrangers existent dans tous les domaines et ils ont fait leur preuve. "
Autre sujet,"Création d’une police militaire et renforcement des forces de l’ordre La France compte 150 000 policiers, 100 000 gendarmes et quelques 17 000 douaniers. D’année en année il manque de plus en plus de force de l’ordre malgré cela. Pour réaffecter des hommes, une solution simple existe. Convertir des militaires du rang en « police militaire ». Une formation militaire est une base pour devenir policier. En rapatriant une partie des quelques 17 000 militaires en opérations extérieurs, ainsi que des militaires de réserves on pourrait réaffecter entre 10 à 20 %  dans les forces de les forces de l’ordre conventionnelles. Cela ne coute rien au contribuable car on se limite au strict personnel existant.
"
,"Organisation des services publiques  Fonctionnaires  Réformer les services publiques notamment l’éducation nationale : en diminuer les effectifs, augmenter les temps de travail, beaucoup  mieux rémunérer les enseignants, avec prime au mérite.
Repasser au crible tout ce qui est fonctionnarisé et privatiser ce qui peut l’être, partout (pole emploi ?). 
Suppression des augmentations de salaire des fonctionnaires à l’ancienneté, redistribuer la masse qui lui était consacrée en augmentations individuelles.
"
"Impôts, dépenses, action publique","Retraite maximum Plafonner la retraite sous forme de ""retraite maximum"" pour les personnes ayant eu des salaires de plus de 150 000 € brutes annuelle durant 10 années consécutives avant la retraite. Minimiser la revalorisation à 1 euros ou 1 centime symbolique lorsque les pensions bénéficient d'une hausse. "
Autre sujet,"Supprimer plusieurs types de contrats de travail  Les entreprises sont friandes des contrats précaires au détriment des salariés. Entre le portage salarial ou l’on prend une commission selon que vous ou votre employeur trouve le client, le travailleur détaché, le cdi intérim, la prestation de service, l’autoentreprise ou le salaire tombe à 45 jours … Parmi tous ces contrats l’un d’eux est vraiment dangereux. Une entreprise étrangère établie en France vous paye depuis son siège situé à l’étranger, résultat seules les cotisations sécu sont payées, pas les cotisations chômages. En fin de période d’essai vous n’êtes pas embauché ? L’équation est simple au chômage, sans ressources car l’entreprise n’a pas cotisé pour le chômage, situation financière précaire."
"Impôts, dépenses, action publique","Réorganiser les sites web administratif par type de guichet  On ne compte plus le nombre de services en ligne doublon ou bien qui oblige de basculer entre plusieurs administration. D’office on devrait en conserver 6 (impôts, assurance retraite, assurance maladie, aide sociale, pôle emploi, administratif divers).  
Pour preuve il existe 3 sites en lien avec l’assurance retraite : https://www.lassuranceretraite.fr , www.agirc-arrco.fr , https://www.info-retraite.fr . Une plateforme unique est plus simple de fonctionnement et en cout de gestion. Autre exemple, il existe 2 sites en lien avec l’emploi : pole-emploi.fr et https://www.moncompteactivite.gouv.fr . 
Des sites divers tel que les contacts avec la CNIL, le dépôt de plainte en ligne, le service bloctel, l’inscription sur liste rouge , la demande d’extrait de casier judiciaire, le renouvellement de document d’identité doivent basculer sur un guichet unique qu’est https://www.service-public.fr .
"
Organisation de l’Etat et des collectivités publiques,"Rationaliser le nombre d'échelons administratifs En France les échelons administratifs sont les suivant : comité de quartier , arrondissement de ville , ville , circonscription (en lien avec le découpage électoral) , interco , métropole , arrondissement de département , département , région , état , Europe . Cela fait 11 échelons . Nous devons en réduire le nombre drastiquement en commençant par le comité de quartiers, les circonscriptions et  les arrondissements de département.
"
"Impôts, dépenses, action publique","Frais de port, taxe de douane, transit des containers et import de marchandise Avec le boom du E-commerce et la mondialisation de plus en plus de bien manufacturés viennent d’Asie et en particulier de Chine. Un vaste système d’évasion fiscale arrive en provenance de Chine. En effet les flux de marchandises arrivant dans les ports sont plus difficilement contrôlables que dans les aéroports. Résultat les douanes se retrouvent à laisser passer des quantités marchandises importées par bateau. Cette marchandise va échapper à la TVA, au frais de port et au frais de douane. Chaque année 3 à 6 milliards d’€ sont perdues par l’état faute de pouvoir contrôler suffisamment les containers dans les ports."
Démocratie et citoyenneté,"Prison, criminalité, délit et peines exemplaires  De plus en plus la population carcérale est en constante augmentation avec des taux d’occupations au-dessus des 100 %. Pour remédier au problème il existe plusieurs solutions somme toute simple. Réouverture des « bagnes » ou « goulag » moderne avec encadrement militaire obligatoire durant 3 à 5 ans pour les détenus et les recadrer. Ces camps pour remettre dans le droit chemin, peuvent être ouverts en Guyane pour avoir un environnement dur qui n’est pas une promenade de santé avec la jungle amazonienne. Toute personne qui obtient la nationalité, commet de graves faits, se verrait amputé de sa nationalité avec un retour dans son pays d’origine avec interdiction à vis du territoire français. Toute personne qui commet de graves faits cette fois dans un pays étranger doit être jugé et emprisonné dans le pays ou le méfait a été commis, la justice française n’est pas supérieure à celle d’un autre pays.
"
"Impôts, dépenses, action publique","Imposer tous les revenus Tous les revenus doivent être déclarés et rentrer dans la base imposable, les heures supplémentaires, les allocations familiales, les salaires des assistantes maternelles... Tout le monde doit participer à l'impôt quel que soit son revenu, le plus minime soit-il. Il faut ( re)créer une tranche d'impôt à 50 % voire plus. "
"Impôts, dépenses, action publique","CSG , retraite & baisse des cotisations  Supprimer la CSG sur les petites retraites, sur le reste conserver le taux le plus bas possible."
Organisation de l’Etat et des collectivités publiques,"Promesses suite et comment les tenir                5/« nous réduirons d’environ un tiers le nombre de députés et de sénateurs »
Pour les promesses 2 et 3 normalement prévues le 01 11 2019 et le 01 01 2020 Pour la promesse 4 :notre proposition : « imposition au même titre que les autres entreprises » 
 Pour moi, il n’y a pas de questions interdites. Nous ne serons pas d’accord sur tout, c’est normal, c’est la démocratie »
  1/ suppression de la flat taxes ou augmentation du taux 
Bercy révèle que les cent premiers contribuables à l'ISF verront leur imposition sur leurs revenus financiers baisser pour chacun en moyenne de 582.380 euros par an avec la flat taxes.Ces foyers bénéficieront donc d'un allégement de 572 millions d'euros en 2018 et de 836 millions en 2019.Vincent Eblé (Président de la commission des finances  ) juge    leur coût  à  4,5 milliards en 2018 et 5,1 milliards en 2019.
  2 / rétablissement de l isf
Ce qui représenterait  un gain de  5 milliards d euros 

"
"Impôts, dépenses, action publique","Création de Contrats de Travail Longue Durée pour les + de 50 ans avec subvention en fin de contrat Nécessité de créer des vrais contrats de travail aidés pour les + de 50 ans  au chômage afin qu'ils puissent accéder à des emplois durables permettant au salarié de pouvoir rester en poste le plus longtemps possible.

L'aide pour l'employeur serait versée à 20% en début de contrat, et à 80% en fin de contrat.

L'employeur pourrait recevoir une prime additionnelle s'il garde le salarié jusqu'à son départ à la retraite.

Ce contrat aurait une durée d'un an minimum à dix ou douze ans.

Afin de faire changer les mentalités et les pratiques des recruteurs, les pouvoirs publics et Pole Emploi devront communiquer de manière affirmée sur la nécessité de faire travailler toutes les catégories d'âge au sein des entreprises, des jeunes jusqu'aux seniors, et que la discrimination à l'embauche devra être réprimée.
"
"Impôts, dépenses, action publique","Inflation fin 2018 à 1.85%, et la retraite a augmentée que de 0.3% au 1er Janvier. De combien de % aurait t'elle dû augmenter et pourquoi ?? Impôts, dépenses, action publique !!"
"Impôts, dépenses, action publique","Réalisation d'économies, impôts et transparence des coûts pour les citoyens Bonjour,
Je propose que l'on utilise d'avantage les rapports de la cours des comptes et que l'on présente régulièrement et de façon simple aux Français le coût (surtout pour ceux qui paient des impôts) de certains événements ou les coûts de fonctionnement de certaines organisations nationales. 
Concernant certaines dépenses publiques, aux vues de leur intérêt limité dans la vie de nos concitoyens (j'entends par là que ces dépenses sont superflues et n'impactent pas notre quotidien), on pourrait allouer ces économies à des activités qui génèrent de la valeur ajoutée à l'économie et aux concitoyens. 
Voilà quelques pistes de réflexion... basées sur la rationalisation et le bon sens.
"
Transition écologique,"La rénovation énergétique: la France en retard sur ses objectifs Aujourd'hui, 288 000 logements privés font l'objet d'une rénovation performante chaque année. 54 000 sont des passoires thermiques et 35% de ces logements sont occupés par des ménages précaires.
La loi de transition énergétique prévoit:
- L'élimination des passoires thermiques en 2025
- 500 000 rénovations ""performantes""  dans le privé
- Réduction de la précarité énergétique de 15% en 2020 par rapport à 2015
(source Novethic.fr)
La France est en retard sur ses objectifs
 "
Organisation de l’Etat et des collectivités publiques,"Retour des EVS dans les écoles Ces postes si utiles aux directeurs d'école ont été supprimés.
Ces contrats aidés permettaient aux citoyens de retrouver un emploi et étaient très utiles aux directeurs.
Ces contrats sur des postes à temps partiel mériteraient d'être remis en place avec un nombre d'heures plus important."
,"Impôt sur le revenu (IRPP) pour tous Tous les français devraient être soumis à l’IRPP (impôt sur les revenus). Il n’est pas acceptable dans un pays démocratique que seuls 46% des français le paye). Il doit y avoir une adhésion générale à cet impôt dont la redistribution profite à tous.
Si ce n’est pas possible, il faut alors passer à la CSG pour tous."
"Impôts, dépenses, action publique","Aménager l’existant au profit de nouveaux axes  Dans le domaine routier et ferroviaire il existe nombre de projet d’aménagement du territoire. Dans bon nombre de cas un projet neuf peut être mis en concurrence avec l’aménagement de l’existant. Par exemple privilégier le doublement sur place la RN184 à une A104 neuve, privilégier la création d’un tunnel sur la jonction Rocade Arc en Ciel / A64 en lieu et place d’une autoroute entre le sud de Toulouse et l’A64 à travers champs, créer un tunnel sous l’ouest Lyonnais pour relier la D342 et l’A450 en lieu et place de l’anneau des sciences, mettre à niveau l’ensemble du linéaire routier Lens / Armentières & la frontière belge en lieu et place du contournement sud est de Lille. Ces pratiques peuvent permettre de réduire de moitié le coup initial des projets. Ce qui n’est pas dépenser est à rediriger massivement vers la complémentation en transport en commun et train, pour compléter l’offre de transport."
"Impôts, dépenses, action publique","Rééquilibrage économique -Suppression de la TVA sur les produits de 1ère nécessité. Malte, l'Irlande et le Royaume Uni appliquent une taxe de 0% sur les produits alimentaires de base
- Diminution de la TVA sur l'eau, le gaz, l'électricité ainsi que leur abonnement"
Démocratie et citoyenneté,"Création de l'Assemblée constitutante - Convoquer un référendum pour engager le processus constituant (modalités de la composition de l'Assemblée constituante, mode de scrutin, parité, tirage au sort et incompatibilité, modalités de la délibération, association des citoyens aux travaux...)
- le projet de Constitution proposé par l'Assemblée constituante sera soumis à un référendum d'approbation
-Les délégués à l'Assemblée constituante ne pourront être candidats aux élections suivant l'entrée en vigueur de la nouvelle Constitutiton"
